{
  "$schema": "https://json-schema.org/draft/2020-12/schema",
  "$id": "https://efij.github.io/AgentDFIR/schema/action-graph.schema.json",
  "title": "AgentDFIR Action Graph",
  "description": "Who did what through whom: normalized/lineage.json and the JSON of `agentdfir lineage`. Every edge is backed by something the evidence records and carries its basis, the evidence state of the step, and source references to check it by hand; time proximity alone is never a basis. Node kinds and edge relations are open sets: a consumer MUST accept values it does not know (later revisions add kinds such as outcome nodes) and SHOULD treat them as opaque. Defined by .adfir spec 0.2.2; graphs written before 0.2.2 also validate (adfir_spec and limitations are optional).",
  "type": "object",
  "required": ["schema", "case_id", "scope", "nodes", "edges", "limits", "truncated", "omitted", "notes"],
  "properties": {
    "schema": {"type": "string", "pattern": "^agentdfir\\.lineage/[0-9]+$", "description": "agentdfir.lineage/1 today."},
    "adfir_spec": {"type": "string", "pattern": "^[0-9]+\\.[0-9]+(\\.[0-9]+)?$", "description": "Spec revision whose edge rules the graph follows. From 0.2.2: an edge whose evidence_state is CORROBORATED cites a telemetry_ref or states in limitations why not."},
    "case_id": {"type": "string"},
    "scope": {
      "type": "object",
      "required": ["events_considered"],
      "properties": {
        "session_id": {"type": "string"},
        "finding": {"type": "string"},
        "finding_keys": {"type": "array", "items": {"type": "string"}},
        "events_considered": {"type": "integer", "minimum": 0}
      }
    },
    "nodes": {"type": "array", "items": {"$ref": "#/$defs/node"}},
    "edges": {"type": "array", "items": {"$ref": "#/$defs/edge"}},
    "limits": {
      "type": "object",
      "required": ["max_nodes", "max_edges"],
      "properties": {"max_nodes": {"type": "integer", "minimum": 0}, "max_edges": {"type": "integer", "minimum": 0}}
    },
    "truncated": {"type": "boolean", "description": "True when the bounds left nodes or edges out; omitted counts them."},
    "omitted": {
      "type": "object",
      "required": ["nodes", "edges"],
      "properties": {"nodes": {"type": "integer", "minimum": 0}, "edges": {"type": "integer", "minimum": 0}}
    },
    "notes": {"type": "array", "items": {"type": "string"}}
  },
  "$defs": {
    "evidenceState": {
      "description": "Corroboration state (see event.schema.json); empty when none was established.",
      "enum": ["", "REQUESTED", "REPORTED", "OBSERVED", "PARTIALLY_CORROBORATED", "CORROBORATED", "CONTRADICTED", "UNKNOWN"]
    },
    "knownKind": {
      "description": "Node kinds AgentDFIR writes. human: the account that prompted; agent / subagent; tool_call (a recorded tool invocation; 'tool' is reserved for a tool definition); process (from endpoint telemetry); file; network (a host, address or login); cloud_resource; mcp_server; resource and outcome are reserved for the proof engine (an affected resource, the effect of an action).",
      "enum": ["human", "agent", "subagent", "tool_call", "tool", "process", "file", "network", "cloud_resource", "resource", "mcp_server", "outcome"]
    },
    "node": {
      "type": "object",
      "required": ["id", "kind", "label"],
      "properties": {
        "id": {"type": "string", "minLength": 1, "description": "Unique within the graph; '<kind prefix>:<identity>', e.g. agent:main:<session>, tool:<event id>, process:<source>:<ref>."},
        "kind": {"anyOf": [{"$ref": "#/$defs/knownKind"}, {"type": "string", "pattern": "^[a-z][a-z0-9_]*$"}]},
        "label": {"type": "string"},
        "evidence_state": {"$ref": "#/$defs/evidenceState"},
        "attributes": {"type": "object", "additionalProperties": {"type": "string"}},
        "source_refs": {"type": "array", "items": {"$ref": "#/$defs/sourceRef"}}
      }
    },
    "edge": {
      "type": "object",
      "required": ["from", "to", "relation", "basis", "evidence_state", "source_refs"],
      "properties": {
        "from": {"type": "string", "minLength": 1, "description": "A node id in this graph."},
        "to": {"type": "string", "minLength": 1, "description": "A node id in this graph."},
        "relation": {"type": "string", "minLength": 1, "examples": ["prompted", "spawned", "invoked", "named_destination", "wrote", "edited", "read", "named_file", "called", "executed_as", "ran_script", "looked_up", "logged_in", "touched", "connected_to", "acted_on", "child_process"]},
        "basis": {"type": "string", "description": "Why the edge exists, in words: a recorded id, a pid/ppid, a named path or destination, or a scored correlation."},
        "evidence_state": {"$ref": "#/$defs/evidenceState", "description": "The corroboration state of the recorded step the edge derives from."},
        "confidence": {"type": "string", "description": "Present on correlated edges only: the correlation's own confidence (correlate.MatchBasis). A correlated edge cites both the agent record and the telemetry record it was paired with."},
        "note": {"type": "string"},
        "source_refs": {"type": "array", "minItems": 1, "items": {"$ref": "#/$defs/sourceRef"}},
        "limitations": {"type": "array", "items": {"type": "string"}, "description": "What the edge does not show, in words (0.2.2)."}
      }
    },
    "sourceRef": {
      "type": "object",
      "description": "A sealed artifact line (artifact_id, logical_path, line, offset, event_id) or a line of imported telemetry (telemetry_ref, a second witness).",
      "anyOf": [{"required": ["artifact_id"]}, {"required": ["event_id"]}, {"required": ["telemetry_ref"]}],
      "properties": {
        "artifact_id": {"type": "string", "pattern": "^[0-9a-f]{64}$"},
        "logical_path": {"type": "string"},
        "line": {"type": "integer", "minimum": 0},
        "offset": {"type": "integer", "minimum": 0},
        "event_id": {"type": "string"},
        "telemetry_ref": {"type": "string", "description": "'<telemetry source> <record ref>'"}
      }
    }
  }
}
